{
  "$schema": "https://json-schema.org/draft/2020-12/schema",
  "$id": "https://github.com/interactive-project/simulation/blob/main/schemas/simulation.v1.schema.json",
  "type": "object",
  "properties": {
    "simulationVersion": {
      "const": "1.0.0"
    },
    "model": {
      "type": "object",
      "properties": {
        "id": {
          "type": "string",
          "maxLength": 128,
          "pattern": "^[a-z0-9][a-z0-9.-]*/[a-z0-9][a-z0-9._-]*$"
        },
        "modelVersion": {
          "type": "string",
          "pattern": "^(0|[1-9][0-9]*)\\.(0|[1-9][0-9]*)\\.(0|[1-9][0-9]*)$"
        },
        "stateVersion": {
          "type": "string",
          "pattern": "^(0|[1-9][0-9]*)\\.(0|[1-9][0-9]*)\\.(0|[1-9][0-9]*)$"
        },
        "dimension": {
          "enum": [
            0,
            2,
            3
          ]
        },
        "units": {
          "type": "array",
          "maxItems": 32,
          "uniqueItems": true,
          "items": {
            "type": "string",
            "pattern": "^[A-Za-z][A-Za-z0-9._-]{0,63}$"
          }
        },
        "data": {
          "type": "object",
          "additionalProperties": true
        }
      },
      "required": [
        "id",
        "modelVersion",
        "stateVersion",
        "dimension",
        "units",
        "data"
      ],
      "additionalProperties": false
    },
    "parameters": {
      "type": "array",
      "maxItems": 64,
      "items": {
        "oneOf": [
          {
            "type": "object",
            "properties": {
              "id": {
                "type": "string",
                "pattern": "^[A-Za-z][A-Za-z0-9._-]{0,63}$"
              },
              "unit": {
                "anyOf": [
                  {
                    "type": "string",
                    "pattern": "^[A-Za-z][A-Za-z0-9._-]{0,63}$"
                  },
                  {
                    "type": "null"
                  }
                ]
              },
              "valueType": {
                "const": "number"
              },
              "default": {
                "type": "number"
              },
              "minimum": {
                "type": "number",
                "minimum": -1000000000000,
                "maximum": 1000000000000
              },
              "maximum": {
                "type": "number",
                "minimum": -1000000000000,
                "maximum": 1000000000000
              }
            },
            "required": [
              "id",
              "unit",
              "valueType",
              "default",
              "minimum",
              "maximum"
            ],
            "additionalProperties": false
          },
          {
            "type": "object",
            "properties": {
              "id": {
                "type": "string",
                "pattern": "^[A-Za-z][A-Za-z0-9._-]{0,63}$"
              },
              "unit": {
                "anyOf": [
                  {
                    "type": "string",
                    "pattern": "^[A-Za-z][A-Za-z0-9._-]{0,63}$"
                  },
                  {
                    "type": "null"
                  }
                ]
              },
              "valueType": {
                "const": "integer"
              },
              "default": {
                "type": "integer"
              },
              "minimum": {
                "type": "integer",
                "minimum": -1000000000000,
                "maximum": 1000000000000
              },
              "maximum": {
                "type": "integer",
                "minimum": -1000000000000,
                "maximum": 1000000000000
              }
            },
            "required": [
              "id",
              "unit",
              "valueType",
              "default",
              "minimum",
              "maximum"
            ],
            "additionalProperties": false
          },
          {
            "type": "object",
            "properties": {
              "id": {
                "type": "string",
                "pattern": "^[A-Za-z][A-Za-z0-9._-]{0,63}$"
              },
              "unit": {
                "type": "null"
              },
              "valueType": {
                "const": "boolean"
              },
              "default": {
                "type": "boolean"
              }
            },
            "required": [
              "id",
              "unit",
              "valueType",
              "default"
            ],
            "additionalProperties": false
          },
          {
            "type": "object",
            "properties": {
              "id": {
                "type": "string",
                "pattern": "^[A-Za-z][A-Za-z0-9._-]{0,63}$"
              },
              "unit": {
                "type": "null"
              },
              "valueType": {
                "const": "enum"
              },
              "default": {
                "type": "string",
                "maxLength": 64
              },
              "values": {
                "type": "array",
                "maxItems": 64,
                "uniqueItems": true,
                "items": {
                  "type": "string",
                  "minLength": 1,
                  "maxLength": 64
                },
                "minItems": 1
              }
            },
            "required": [
              "id",
              "unit",
              "valueType",
              "default",
              "values"
            ],
            "additionalProperties": false
          }
        ]
      }
    },
    "parameterValues": {
      "type": "object",
      "maxProperties": 64,
      "propertyNames": {
        "type": "string",
        "pattern": "^[A-Za-z][A-Za-z0-9._-]{0,63}$"
      },
      "additionalProperties": {
        "type": [
          "number",
          "boolean",
          "string"
        ],
        "maxLength": 64
      }
    },
    "inputs": {
      "type": "array",
      "maxItems": 64,
      "items": {
        "oneOf": [
          {
            "type": "object",
            "properties": {
              "id": {
                "type": "string",
                "pattern": "^[A-Za-z][A-Za-z0-9._-]{0,63}$"
              },
              "unit": {
                "anyOf": [
                  {
                    "type": "string",
                    "pattern": "^[A-Za-z][A-Za-z0-9._-]{0,63}$"
                  },
                  {
                    "type": "null"
                  }
                ]
              },
              "valueType": {
                "const": "number"
              },
              "default": {
                "type": "number"
              },
              "minimum": {
                "type": "number",
                "minimum": -1000000000000,
                "maximum": 1000000000000
              },
              "maximum": {
                "type": "number",
                "minimum": -1000000000000,
                "maximum": 1000000000000
              }
            },
            "required": [
              "id",
              "unit",
              "valueType",
              "default",
              "minimum",
              "maximum"
            ],
            "additionalProperties": false
          },
          {
            "type": "object",
            "properties": {
              "id": {
                "type": "string",
                "pattern": "^[A-Za-z][A-Za-z0-9._-]{0,63}$"
              },
              "unit": {
                "anyOf": [
                  {
                    "type": "string",
                    "pattern": "^[A-Za-z][A-Za-z0-9._-]{0,63}$"
                  },
                  {
                    "type": "null"
                  }
                ]
              },
              "valueType": {
                "const": "integer"
              },
              "default": {
                "type": "integer"
              },
              "minimum": {
                "type": "integer",
                "minimum": -1000000000000,
                "maximum": 1000000000000
              },
              "maximum": {
                "type": "integer",
                "minimum": -1000000000000,
                "maximum": 1000000000000
              }
            },
            "required": [
              "id",
              "unit",
              "valueType",
              "default",
              "minimum",
              "maximum"
            ],
            "additionalProperties": false
          },
          {
            "type": "object",
            "properties": {
              "id": {
                "type": "string",
                "pattern": "^[A-Za-z][A-Za-z0-9._-]{0,63}$"
              },
              "unit": {
                "type": "null"
              },
              "valueType": {
                "const": "boolean"
              },
              "default": {
                "type": "boolean"
              }
            },
            "required": [
              "id",
              "unit",
              "valueType",
              "default"
            ],
            "additionalProperties": false
          },
          {
            "type": "object",
            "properties": {
              "id": {
                "type": "string",
                "pattern": "^[A-Za-z][A-Za-z0-9._-]{0,63}$"
              },
              "unit": {
                "type": "null"
              },
              "valueType": {
                "const": "enum"
              },
              "default": {
                "type": "string",
                "maxLength": 64
              },
              "values": {
                "type": "array",
                "maxItems": 64,
                "uniqueItems": true,
                "items": {
                  "type": "string",
                  "minLength": 1,
                  "maxLength": 64
                },
                "minItems": 1
              }
            },
            "required": [
              "id",
              "unit",
              "valueType",
              "default",
              "values"
            ],
            "additionalProperties": false
          }
        ]
      }
    },
    "state": {
      "type": "array",
      "minItems": 1,
      "maxItems": 128,
      "items": {
        "oneOf": [
          {
            "type": "object",
            "properties": {
              "id": {
                "type": "string",
                "pattern": "^[A-Za-z][A-Za-z0-9._-]{0,63}$"
              },
              "unit": {
                "anyOf": [
                  {
                    "type": "string",
                    "pattern": "^[A-Za-z][A-Za-z0-9._-]{0,63}$"
                  },
                  {
                    "type": "null"
                  }
                ]
              },
              "valueType": {
                "const": "number"
              },
              "default": {
                "type": "number"
              },
              "minimum": {
                "type": "number",
                "minimum": -1000000000000,
                "maximum": 1000000000000
              },
              "maximum": {
                "type": "number",
                "minimum": -1000000000000,
                "maximum": 1000000000000
              }
            },
            "required": [
              "id",
              "unit",
              "valueType",
              "default",
              "minimum",
              "maximum"
            ],
            "additionalProperties": false
          },
          {
            "type": "object",
            "properties": {
              "id": {
                "type": "string",
                "pattern": "^[A-Za-z][A-Za-z0-9._-]{0,63}$"
              },
              "unit": {
                "anyOf": [
                  {
                    "type": "string",
                    "pattern": "^[A-Za-z][A-Za-z0-9._-]{0,63}$"
                  },
                  {
                    "type": "null"
                  }
                ]
              },
              "valueType": {
                "const": "integer"
              },
              "default": {
                "type": "integer"
              },
              "minimum": {
                "type": "integer",
                "minimum": -1000000000000,
                "maximum": 1000000000000
              },
              "maximum": {
                "type": "integer",
                "minimum": -1000000000000,
                "maximum": 1000000000000
              }
            },
            "required": [
              "id",
              "unit",
              "valueType",
              "default",
              "minimum",
              "maximum"
            ],
            "additionalProperties": false
          },
          {
            "type": "object",
            "properties": {
              "id": {
                "type": "string",
                "pattern": "^[A-Za-z][A-Za-z0-9._-]{0,63}$"
              },
              "unit": {
                "type": "null"
              },
              "valueType": {
                "const": "boolean"
              },
              "default": {
                "type": "boolean"
              }
            },
            "required": [
              "id",
              "unit",
              "valueType",
              "default"
            ],
            "additionalProperties": false
          },
          {
            "type": "object",
            "properties": {
              "id": {
                "type": "string",
                "pattern": "^[A-Za-z][A-Za-z0-9._-]{0,63}$"
              },
              "unit": {
                "type": "null"
              },
              "valueType": {
                "const": "enum"
              },
              "default": {
                "type": "string",
                "maxLength": 64
              },
              "values": {
                "type": "array",
                "maxItems": 64,
                "uniqueItems": true,
                "items": {
                  "type": "string",
                  "minLength": 1,
                  "maxLength": 64
                },
                "minItems": 1
              }
            },
            "required": [
              "id",
              "unit",
              "valueType",
              "default",
              "values"
            ],
            "additionalProperties": false
          }
        ]
      }
    },
    "requiredCapabilities": {
      "type": "array",
      "maxItems": 7,
      "uniqueItems": true,
      "items": {
        "enum": [
          "interactive",
          "evaluable",
          "collaborative",
          "offline",
          "deterministic",
          "resumable",
          "aiGeneratable"
        ]
      }
    },
    "requiredOperations": {
      "type": "array",
      "maxItems": 3,
      "uniqueItems": true,
      "items": {
        "enum": [
          "step",
          "input",
          "reset"
        ]
      },
      "minItems": 1
    }
  },
  "required": [
    "simulationVersion",
    "model",
    "parameters",
    "parameterValues",
    "inputs",
    "state",
    "requiredCapabilities",
    "requiredOperations"
  ],
  "additionalProperties": false
}
